{
  "personA": {
    "birthDate": "1995-06-15",
    "birthLocationId": "SYNTHETIC_LOCATION_A",
    "birthTime": "10:30"
  },
  "personB": {
    "birthDate": "1994-08-20",
    "birthLocationId": "SYNTHETIC_LOCATION_A",
    "birthTime": "10:30"
  },
  "relationshipType": "COUPLE",
  "locale": "en-US",
  "targetTimezone": "Asia/Tokyo",
  "startDate": "2026-09-01",
  "endDate": "2026-09-07"
}
